{"schema_version":"0.2","id":"govuk-dsa-2026-27","type":"evidence","status":"reviewed","provenance":{"created":"2026-08-28","created_by":"ND Oracle project-controlled curation","method":"Current GOV.UK Disabled Students' Allowance overview and 2026 to 2027 forms guidance reviewed for an England scheme-scope claim.","review_state":"editor_reviewed","last_reviewed":"2026-08-28"},"title":"Disabled Students' Allowance application forms and notes for 2026 to 2027","source_kind":"authoritative_guidance","citation":"Student Loans Company and Department for Education, Disabled Students' Allowance application forms and notes for 2026 to 2027, GOV.UK, updated 27 August 2026.","locator":{"type":"url","value":"https://www.gov.uk/government/publications/disabled-students-allowance-application-forms-and-notes-for-2026-to-2027"},"date":"2026-08-27","date_precision":"day","accessed":"2026-08-28","authorship":"Student Loans Company and Department for Education","contributions":[{"id":"dsa-england-scope-contribution","claim_ref":"disabled-students-allowance#dsa-england-scope","role":"supportive","finding":"The official 2026 to 2027 DSA application material applies to England and sets the current application/evidence route for eligible students seeking disability-related study support.","population_or_context":"Students using the Student Finance England DSA route for the relevant academic year.","methodology":"Authoritative government/student-finance application guidance rather than an outcome study.","limitations":[{"id":"dsa-year-and-eligibility-limit","text":"Application rules, evidence requirements and support decisions can change by academic year and depend on individual eligibility.","why_it_matters":"The evidence supports the existence and scope of the England route, not an individual award decision.","reopening_or_reduction_conditions":["Recheck when a new academic-year DSA route or major eligibility change is published."],"status":"open"}]}]}