{"schema_version":"0.2","id":"govuk-access-to-work-factsheet-2026","type":"evidence","status":"reviewed","provenance":{"created":"2026-08-28","created_by":"ND Oracle project-controlled curation","method":"Current GOV.UK Access to Work factsheet and eligibility guidance reviewed for a narrow scheme-scope claim.","review_state":"editor_reviewed","last_reviewed":"2026-08-28"},"title":"Access to Work factsheet for customers","source_kind":"authoritative_guidance","citation":"Department for Work and Pensions, Access to Work factsheet for customers, GOV.UK, updated 5 May 2026.","locator":{"type":"url","value":"https://www.gov.uk/government/publications/access-to-work-factsheet/access-to-work-factsheet-for-customers"},"date":"2026-05-05","date_precision":"day","accessed":"2026-08-28","authorship":"Department for Work and Pensions","contributions":[{"id":"atw-scheme-scope-contribution","claim_ref":"access-to-work#atw-scheme-scope","role":"supportive","finding":"The official scheme guidance describes Access to Work as support for eligible people whose disability or health condition affects work in England, Scotland or Wales, with practical support potentially funded through a grant.","population_or_context":"People in or about to start paid work in England, Scotland or Wales who meet current Access to Work conditions.","methodology":"Authoritative government programme guidance rather than an effectiveness study.","limitations":[{"id":"atw-individual-eligibility-limit","text":"The guidance describes scheme rules and possible support, not whether a particular person will qualify or what support they will receive.","why_it_matters":"A scheme-scope claim must not be read as an individual entitlement decision.","reopening_or_reduction_conditions":["Recheck if GOV.UK changes eligibility, geographic scope or support categories."],"status":"open"}]}]}