{"schema_version":"0.2","id":"acas-reasonable-adjustments-2025","type":"evidence","status":"reviewed","provenance":{"created":"2026-08-28","created_by":"ND Oracle project-controlled curation","method":"Current Acas reasonable-adjustments guidance reviewed for a narrow Great Britain guidance claim.","review_state":"editor_reviewed","last_reviewed":"2026-08-28"},"title":"Reasonable adjustments at work","source_kind":"authoritative_guidance","citation":"Acas, Reasonable adjustments at work, updated 30 January 2025.","locator":{"type":"url","value":"https://www.acas.org.uk/reasonable-adjustments"},"date":"2025-01-30","date_precision":"day","accessed":"2026-08-28","authorship":"Acas","contributions":[{"id":"acas-adjustments-guidance-contribution","claim_ref":"acas-reasonable-adjustments#acas-adjustments-guidance","role":"supportive","finding":"Acas guidance for Great Britain describes employers considering reasonable adjustments for disabled workers and job applicants and explains that what is reasonable depends on the circumstances.","population_or_context":"Workers, job applicants and employers in England, Scotland and Wales using Acas employment guidance.","methodology":"Authoritative workplace-relations guidance rather than personalised legal advice or an effectiveness study.","limitations":[{"id":"acas-individual-circumstances-limit","text":"Whether an adjustment is legally required or reasonable in an individual case depends on facts and applicable law; Northern Ireland uses a separate employment-relations system.","why_it_matters":"General guidance cannot determine an individual legal dispute or adjustment duty.","reopening_or_reduction_conditions":["Recheck if Acas updates the guidance or relevant Great Britain law materially changes."],"status":"open"}]}]}